{
  "$schema": "https://json-schema.org/draft/2020-12/schema",
  "title": "EMODnet windfarm feature",
  "description": "GeoJSON representation of the EMODnet Human Activities windfarms feature type. Property names, optionality, nullability, and value types follow the service's published windfarms XSD.\n",
  "type": "object",
  "required": [
    "id",
    "type",
    "geometry",
    "properties"
  ],
  "properties": {
    "id": {
      "type": "string",
      "x-jsonld-id": "@id"
    },
    "type": {
      "const": "Feature",
      "x-jsonld-id": "@type"
    },
    "geometry": {
      "description": "EMODnet the_geom represented as GeoJSON geometry; the XSD allows it to be nil.",
      "oneOf": [
        {
          "type": "null"
        },
        {
          "type": "object",
          "required": [
            "type",
            "coordinates"
          ],
          "properties": {
            "type": {
              "enum": [
                "Point",
                "MultiPoint",
                "LineString",
                "MultiLineString",
                "Polygon",
                "MultiPolygon",
                "GeometryCollection"
              ],
              "x-jsonld-id": "@type"
            },
            "coordinates": {
              "x-jsonld-id": "https://purl.org/geojson/vocab#coordinates",
              "x-jsonld-container": "@list"
            }
          },
          "additionalProperties": true
        }
      ],
      "x-jsonld-id": "https://purl.org/geojson/vocab#geometry"
    },
    "properties": {
      "type": "object",
      "properties": {
        "country": {
          "type": [
            "string",
            "null"
          ],
          "description": "Country name as published by EMODnet; the XSD type is nullable xsd:string.",
          "x-jsonld-id": "https://schema.org/addressCountry",
          "x-jsonld-type": "@vocab"
        },
        "n_turbines": {
          "type": [
            "number",
            "null"
          ],
          "x-jsonld-id": "https://w3id.org/ogc/hosted/seadots/emodnet-compliant-windfarm#nTurbines"
        },
        "power_mw": {
          "type": [
            "number",
            "null"
          ],
          "x-jsonld-id": "https://w3id.org/ogc/hosted/seadots/emodnet-compliant-windfarm#powerMW"
        },
        "status": {
          "type": [
            "string",
            "null"
          ],
          "description": "Status text as published by EMODnet (nullable xsd:string).",
          "x-jsonld-id": "https://w3id.org/ogc/hosted/seadots/emodnet/",
          "x-jsonld-type": "@vocab"
        },
        "type_inst": {
          "type": [
            "string",
            "null"
          ],
          "x-jsonld-id": "https://schema.org/additionalType"
        },
        "updateyear": {
          "type": [
            "string",
            "null"
          ],
          "x-jsonld-id": "https://w3id.org/ogc/hosted/seadots/emodnet-compliant-windfarm#updateYear"
        },
        "year": {
          "type": [
            "string",
            "null"
          ],
          "x-jsonld-id": "https://w3id.org/ogc/hosted/seadots/emodnet-compliant-windfarm#year"
        },
        "dist_coast": {
          "type": [
            "number",
            "null"
          ],
          "x-jsonld-id": "https://w3id.org/ogc/hosted/seadots/emodnet-compliant-windfarm#distanceToCoast"
        },
        "notes": {
          "type": [
            "string",
            "null"
          ],
          "x-jsonld-id": "http://purl.org/dc/terms/description"
        }
      },
      "x-jsonld-id": "https://purl.org/geojson/vocab#properties"
    },
    "additionalProperties": {
      "not": true
    }
  },
  "x-jsonld-extra-terms": {
    "Feature": "https://purl.org/geojson/vocab#Feature",
    "Point": "https://purl.org/geojson/vocab#Point",
    "Polygon": "https://purl.org/geojson/vocab#Polygon",
    "MultiPolygon": "https://purl.org/geojson/vocab#MultiPolygon"
  },
  "x-jsonld-vocab": "https://w3id.org/ogc/hosted/seadots/emodnet/",
  "x-jsonld-prefixes": {
    "geojson": "https://purl.org/geojson/vocab#",
    "schema": "https://schema.org/",
    "seadots": "https://w3id.org/ogc/hosted/seadots/emodnet-compliant-windfarm#",
    "dcterms": "http://purl.org/dc/terms/",
    "seadots-emodnet": "https://w3id.org/ogc/hosted/seadots/emodnet/",
    "inspire-cofv": "http://inspire.ec.europa.eu/codelist/ConditionOfFacilityValue/"
  },
  "x-bblocks-metadata": {
    "itemIdentifier": "ogc.hosted.seadots.emodnet-compliant-windfarm",
    "register": "https://ogcincubator.github.io/bblocks-seadots/build/register.json",
    "version": "0.1",
    "dateOfLastChange": "2026-07-24"
  }
}