{
  "id": "https://example.org/windfarms/belgium-belwind-alstom-haliade-demonstration-bligh-bank",
  "type": "Feature",
  "geometry": {
    "type": "Point",
    "coordinates": [2.84, 51.69]
  },
  "properties": {
    "country": "Belgium",
    "n_turbines": 1,
    "power_mw": 6,
    "status": "Production",
    "type_inst": "Grounded",
    "updateyear": "2024",
    "year": "2013",
    "dist_coast": 43900.7770495,
    "notes": null
  }
}
