{
  "id": "urn:baltic-ses:national:1:example-project",
  "type": "Feature",
  "geometry": null,
  "properties": {
    "name": "Example Baltic Wind",
    "country": "Poland",
    "n_turbines": null,
    "power_mw": 1200,
    "status": "Planned",
    "type_inst": null,
    "updateyear": "2026",
    "year": "2028",
    "dist_coast": null,
    "notes": "Year reported as assumed in the source.",
    "developer": "Example Energy",
    "status_detail": "In planning (auction pathway)",
    "status_as_of": "2026-08-26",
    "year_semantics": "planned first-power or completion year",
    "year_is_assumed": true,
    "source_dataset": "Polish national offshore wind project pipeline",
    "source_reference": "https://www.gramwzielone.pl/?p=20373718",
    "source_snapshot_date": "2026-08-26",
    "source_record_id": "national-1"
  }
}
