{
  "id": "https://example.org/wind-farms/north-sea-demo-01",
  "type": "Feature",
  "geometry": {
    "type": "Polygon",
    "coordinates": [[
      [4.9000, 54.2000],
      [4.9800, 54.2000],
      [4.9800, 54.2600],
      [4.9000, 54.2600],
      [4.9000, 54.2000]
    ]]
  },

  "properties": {
    "title": "North Sea Demonstrator Offshore Wind Farm",
    "description": "Illustrative EMODnet Human Activities contribution record for an operational offshore wind-farm field.",
    "windFarm": {
      "identifier": "NS-DEMO-01",
      "name": "North Sea Demonstrator Offshore Wind Farm",
      "country": "NL",
      "lifecycleStatus": "operational",
      "turbineCount": 24,
      "installedCapacityMW": 288,
      "validFrom": "2025-01-01",
      "commissioningDate": "2025-01-01",
      "operator": "Example Offshore Energy B.V.",
      "sourceDataset": "https://example.org/datasets/north-sea-demo-wind-farm.geojson",
      "metadataRecord": "https://example.org/metadata/north-sea-demo-wind-farm",
      "updateDate": "2026-07-01",
      "positionalAccuracyM": 10,
      "remarks": "Illustrative record; replace all example URLs and values with the authoritative provider data and metadata record before publication."
    }
  }
}
