{
  "id": "emodnet-001",
  "type": "Feature",
  "geometry": {
    "type": "Point",
    "coordinates": [
      17.65,
      55.05
    ]
  },
  "properties": {
    "name": "Baltic Power",
    "status": "Construction",
    "power_mw": 1140,
    "n_turbines": 76,
    "year": "2026",
    "dist_coast_m": 28427,
    "updateyear": "2026",
    "lon": 17.65,
    "lat": 55.05
  }
}